{
  "$schema": "../../../../schemas/image.schema.json",
  "schema_version": 1,
  "id": "vllm-deepseek-v4-flash-0731-dspark-gb10",
  "description": "Pinned-source DeepSeek V4 Flash 0731 vLLM runtime for two NVIDIA DGX Sparks",
  "vendor": "nvidia",
  "hardware_family": "dgx-spark",
  "platform": "linux/arm64",
  "registry_repository": "petabridge/vllm-deepseek-v4-flash-0731-dspark-gb10",
  "build_enabled": true,
  "context": "images/nvidia/dgx-spark/deepseek-v4-flash-0731",
  "dockerfile": "images/nvidia/dgx-spark/deepseek-v4-flash-0731/Dockerfile"
}
