{
  "$schema": "../../../../schemas/image.schema.json",
  "schema_version": 1,
  "id": "tensorfold-glm-5-3-flash-gb10",
  "description": "GLM-5.3-Flash EXL3 TensorFold runtime (MiaAI-Lab recipe) for two NVIDIA DGX Sparks",
  "vendor": "nvidia",
  "hardware_family": "dgx-spark",
  "platform": "linux/arm64",
  "registry_repository": "petabridge/tensorfold-glm-5-3-flash-gb10",
  "build_enabled": true,
  "context": "images/nvidia/dgx-spark/glm-53-flash-tensorfold/recipe",
  "dockerfile": "images/nvidia/dgx-spark/glm-53-flash-tensorfold/recipe/Dockerfile"
}
